[
  {
    "caseId": "docs",
    "environment": {
      "goVersion": "module-selected go1.26.6",
      "kind": "source-static",
      "networkProfile": "no-live-mutations",
      "nodeVersion": "host v22.22.1"
    },
    "execution": {
      "command": "make docs-check",
      "executedCases": 0,
      "exitCode": 0,
      "expectedCases": 0,
      "finishedAt": "2026-10-09T18:53:22Z",
      "startedAt": "2026-10-09T18:53:19Z",
      "unexpectedSkips": 0
    },
    "result": {
      "artifacts": [
        {
          "digest": "sha256:f326af84f19d34d5328d42e3ce3319b942fecf4b67d935e6dc3a4d814bdf4261",
          "path": "docs/assurance/technology-guide/logs/docs.log"
        }
      ],
      "assertions": [
        "Command exited zero with retained output."
      ],
      "limitations": [
        "Static/characterization evidence only; no release, CNPG live, browser or signature qualification."
      ],
      "status": "pass"
    },
    "schemaVersion": 1,
    "source": {
      "applicationCommit": "6c3da1882c76662f1b7e01e80f89f5e2978bc7b4",
      "candidateSourceTreeDigest": "sha256:b51ab945b6a935acdda650ace1aeafecbf90c383c1ba78ab0a006f2407252087",
      "catalogCommit": "3e24ab98f0805bd54d6591d9b9b961bbfd1f5db5"
    },
    "workPackage": "W00"
  },
  {
    "caseId": "release",
    "environment": {
      "goVersion": "go1.27.2",
      "kind": "source-static",
      "networkProfile": "no-live-mutations",
      "nodeVersion": "host v22.22.1"
    },
    "execution": {
      "command": "GOTOOLCHAIN=go1.27.2 make release-contract-check",
      "executedCases": 55,
      "exitCode": 0,
      "expectedCases": 55,
      "finishedAt": "2026-10-09T18:53:26Z",
      "startedAt": "2026-10-09T18:53:22Z",
      "unexpectedSkips": 0
    },
    "result": {
      "artifacts": [
        {
          "digest": "sha256:d29350c2d17a1c46c00869dc96403ee254d5d67c11bb2f9f256f70acdb8587ef",
          "path": "docs/assurance/technology-guide/logs/release.log"
        }
      ],
      "assertions": [
        "Command exited zero with retained output."
      ],
      "limitations": [
        "Static/characterization evidence only; no release, CNPG live, browser or signature qualification.",
        "Case counts cover 55 Python unit fixtures only; filtered Go command runs zero internal/releasecontract tests, supplemented by separate full package record."
      ],
      "status": "pass"
    },
    "schemaVersion": 1,
    "source": {
      "applicationCommit": "6c3da1882c76662f1b7e01e80f89f5e2978bc7b4",
      "candidateSourceTreeDigest": "sha256:b51ab945b6a935acdda650ace1aeafecbf90c383c1ba78ab0a006f2407252087",
      "catalogCommit": "3e24ab98f0805bd54d6591d9b9b961bbfd1f5db5"
    },
    "workPackage": "W00"
  },
  {
    "caseId": "config",
    "environment": {
      "goVersion": "module-selected go1.26.6",
      "kind": "source-static",
      "networkProfile": "no-live-mutations",
      "nodeVersion": "host v22.22.1"
    },
    "execution": {
      "command": "make config-docs-check",
      "executedCases": 3,
      "exitCode": 0,
      "expectedCases": 3,
      "finishedAt": "2026-10-09T18:53:26Z",
      "startedAt": "2026-10-09T18:53:26Z",
      "unexpectedSkips": 0
    },
    "result": {
      "artifacts": [
        {
          "digest": "sha256:7b7167187b26b281592d8090780301f481d644367df94afe41d1c69cd13e1687",
          "path": "docs/assurance/technology-guide/logs/config.log"
        }
      ],
      "assertions": [
        "Command exited zero with retained output."
      ],
      "limitations": [
        "Static/characterization evidence only; no release, CNPG live, browser or signature qualification."
      ],
      "status": "pass"
    },
    "schemaVersion": 1,
    "source": {
      "applicationCommit": "6c3da1882c76662f1b7e01e80f89f5e2978bc7b4",
      "candidateSourceTreeDigest": "sha256:b51ab945b6a935acdda650ace1aeafecbf90c383c1ba78ab0a006f2407252087",
      "catalogCommit": "3e24ab98f0805bd54d6591d9b9b961bbfd1f5db5"
    },
    "workPackage": "W00"
  },
  {
    "caseId": "cli-baseline",
    "environment": {
      "goVersion": "module-selected go1.26.6",
      "kind": "source-static",
      "networkProfile": "no-live-mutations",
      "nodeVersion": "host v22.22.1"
    },
    "execution": {
      "command": "make cli-docs-check",
      "executedCases": 0,
      "exitCode": 2,
      "expectedCases": 0,
      "finishedAt": "2026-10-09T18:53:27Z",
      "startedAt": "2026-10-09T18:53:26Z",
      "unexpectedSkips": 0
    },
    "result": {
      "artifacts": [
        {
          "digest": "sha256:b2cfb03064bc308958922a2667ecd9905fe6de6664b290863d3b4bf8da4cc0a8",
          "path": "docs/assurance/technology-guide/logs/cli-baseline.log"
        }
      ],
      "assertions": [
        "Observed command failure retained without bypassing production checks."
      ],
      "limitations": [
        "Static/characterization evidence only; no release, CNPG live, browser or signature qualification.",
        "Pre-existing malformed parent .git prevents optional Go VCS stamping; no parent Git metadata modified."
      ],
      "status": "fail"
    },
    "schemaVersion": 1,
    "source": {
      "applicationCommit": "6c3da1882c76662f1b7e01e80f89f5e2978bc7b4",
      "candidateSourceTreeDigest": "sha256:b51ab945b6a935acdda650ace1aeafecbf90c383c1ba78ab0a006f2407252087",
      "catalogCommit": "3e24ab98f0805bd54d6591d9b9b961bbfd1f5db5"
    },
    "workPackage": "W00"
  },
  {
    "caseId": "cli",
    "environment": {
      "goVersion": "go1.27.2",
      "kind": "source-static",
      "networkProfile": "no-live-mutations",
      "nodeVersion": "host v22.22.1"
    },
    "execution": {
      "command": "GOTOOLCHAIN=go1.27.2 make cli-docs-check",
      "executedCases": 0,
      "exitCode": 0,
      "expectedCases": 0,
      "finishedAt": "2026-10-09T18:53:32Z",
      "startedAt": "2026-10-09T18:53:27Z",
      "unexpectedSkips": 0
    },
    "result": {
      "artifacts": [
        {
          "digest": "sha256:97d3a236a5bebfcbff0d3cb428b1ad6620be9a60e5eb514aeaa3b44a582297a9",
          "path": "docs/assurance/technology-guide/logs/cli.log"
        }
      ],
      "assertions": [
        "Command exited zero with retained output."
      ],
      "limitations": [
        "Static/characterization evidence only; no release, CNPG live, browser or signature qualification.",
        "Current Go preflight temporary docs binary; baseline Go command outcome retained separately."
      ],
      "status": "pass"
    },
    "schemaVersion": 1,
    "source": {
      "applicationCommit": "6c3da1882c76662f1b7e01e80f89f5e2978bc7b4",
      "candidateSourceTreeDigest": "sha256:b51ab945b6a935acdda650ace1aeafecbf90c383c1ba78ab0a006f2407252087",
      "catalogCommit": "3e24ab98f0805bd54d6591d9b9b961bbfd1f5db5"
    },
    "workPackage": "W00"
  },
  {
    "caseId": "boundaries",
    "environment": {
      "goVersion": "module-selected go1.26.6",
      "kind": "source-static",
      "networkProfile": "no-live-mutations",
      "nodeVersion": "host v22.22.1"
    },
    "execution": {
      "command": "node scripts/check-dependency-boundaries.mjs",
      "executedCases": 0,
      "exitCode": 0,
      "expectedCases": 0,
      "finishedAt": "2026-10-09T18:53:32Z",
      "startedAt": "2026-10-09T18:53:32Z",
      "unexpectedSkips": 0
    },
    "result": {
      "artifacts": [
        {
          "digest": "sha256:a2c769ae68e911c8361c16e6934e050ec8052f4edcb516921cfbd774d9f3c8d4",
          "path": "docs/assurance/technology-guide/logs/boundaries.log"
        }
      ],
      "assertions": [
        "Command exited zero with retained output."
      ],
      "limitations": [
        "Static/characterization evidence only; no release, CNPG live, browser or signature qualification."
      ],
      "status": "pass"
    },
    "schemaVersion": 1,
    "source": {
      "applicationCommit": "6c3da1882c76662f1b7e01e80f89f5e2978bc7b4",
      "candidateSourceTreeDigest": "sha256:b51ab945b6a935acdda650ace1aeafecbf90c383c1ba78ab0a006f2407252087",
      "catalogCommit": "3e24ab98f0805bd54d6591d9b9b961bbfd1f5db5"
    },
    "workPackage": "W00"
  },
  {
    "caseId": "contracts",
    "environment": {
      "goVersion": "go1.27.2",
      "kind": "source-static",
      "networkProfile": "no-live-mutations",
      "nodeVersion": "host v22.22.1"
    },
    "execution": {
      "command": "GOTOOLCHAIN=go1.27.2 go test -json ./deploy ./internal/releasecontract ./internal/config ./internal/auth -run \"TestApplicationImageUpgrade|TestCloudNative|TestValkey|TestManagedData|TestProduction|TestValidateProduction|TestLoadRejects|TestApplyMirror|TestEncryptorMultiKeyRotation|TestEncryptorAcceptsLegacy|TestValidateToken.*Revoked\" -count=1",
      "executedCases": 35,
      "exitCode": 0,
      "expectedCases": 35,
      "finishedAt": "2026-10-09T18:53:37Z",
      "startedAt": "2026-10-09T18:53:32Z",
      "unexpectedSkips": 0
    },
    "result": {
      "artifacts": [
        {
          "digest": "sha256:3d47a25e279f2091506b7de489379bf77d6c14f4ae905c00ef8da304bbefc6ac",
          "path": "docs/assurance/technology-guide/logs/contracts.log"
        },
        {
          "digest": "sha256:0310281e1f2aedbb5def183a406ba6e79bca2458195f697ac3e41698080efe75",
          "path": "docs/assurance/technology-guide/logs/contracts-expected.log"
        }
      ],
      "assertions": [
        "Command exited zero with retained output."
      ],
      "limitations": [
        "Static/characterization evidence only; no release, CNPG live, browser or signature qualification.",
        "Expected counts were independently enumerated with go test -list; counts cover top-level tests, with subtests visible in JSON logs."
      ],
      "status": "pass"
    },
    "schemaVersion": 1,
    "source": {
      "applicationCommit": "6c3da1882c76662f1b7e01e80f89f5e2978bc7b4",
      "candidateSourceTreeDigest": "sha256:b51ab945b6a935acdda650ace1aeafecbf90c383c1ba78ab0a006f2407252087",